{
  "$schema": "https://json-schema.org/draft/2020-12/schema",
  "$id": "https://raw.githubusercontent.com/RasaOS/domain-canvas/main/schemas/rasa.app.v1.schema.json",
  "title": "rasa.app.v1 — canvas app manifest (app.json)",
  "description": "The manifest every canvas app directory carries. Shape contract only — cross-field law (registry exhaustiveness, event coverage, nav targets) is audited by bin/check-app per content/APP_MODEL.md.",
  "type": "object",
  "required": ["app", "id", "name", "version", "created", "screens", "active_screen", "events"],
  "additionalProperties": false,
  "properties": {
    "app": { "const": "rasa.app.v1" },
    "id": {
      "type": "string",
      "pattern": "^[a-z0-9]+(-[a-z0-9]+)*$",
      "description": "kebab-case, stable, never renamed after creation"
    },
    "name": { "type": "string", "minLength": 1 },
    "version": {
      "type": "string",
      "pattern": "^\\d+\\.\\d+\\.\\d+$",
      "description": "the app's semver: patch = data/state refresh, minor = screen changed/added, major = app model reshaped"
    },
    "created": { "type": "string", "pattern": "^\\d{4}-\\d{2}-\\d{2}$" },
    "screens": {
      "type": "array",
      "minItems": 1,
      "description": "exhaustive — every file in screens/ has a row here and vice versa",
      "items": {
        "type": "object",
        "required": ["id", "title"],
        "additionalProperties": false,
        "properties": {
          "id": { "type": "string", "pattern": "^[a-z0-9]+(-[a-z0-9]+)*$" },
          "title": { "type": "string", "minLength": 1 },
          "default": { "type": "boolean" },
          "parent": {
            "type": "string",
            "pattern": "^[a-z0-9]+(-[a-z0-9]+)*$",
            "description": "if present, this screen is a LEAF/detail whose single structural back-target is this (registered, acyclic, rooted) screen id; absent = a top-level SECTION. Nav classes derive from presence/absence; the parent-graph + nav-region law is enforced by bin/check-app per content/APP_MODEL.md"
          }
        }
      }
    },
    "active_screen": {
      "type": "string",
      "description": "the screen currently projected onto the canvas; must be a registered screen id"
    },
    "data_sources": {
      "type": "array",
      "items": {
        "type": "object",
        "required": ["path", "purpose"],
        "additionalProperties": false,
        "properties": {
          "path": { "type": "string", "description": "tenant-relative; never outside the tenant root" },
          "purpose": { "type": "string", "minLength": 1 }
        }
      }
    },
    "events": {
      "type": "array",
      "description": "exhaustive — every action any published screen can emit has a row; EVENT executes the row exactly",
      "items": {
        "type": "object",
        "required": ["action", "emits", "handling"],
        "additionalProperties": false,
        "properties": {
          "action": { "type": "string", "minLength": 1 },
          "emits": {
            "type": "array",
            "minItems": 1,
            "items": { "type": "string" },
            "description": "region id(s) that emit this action"
          },
          "handling": { "type": "string", "minLength": 1, "description": "what the user was promised — the declared behavior" },
          "target": {
            "type": "string",
            "pattern": "^[a-z0-9]+(-[a-z0-9]+)*$",
            "description": "for a switch/spawn action (a list card opening a detail, a wizard 'next'), the screen id it navigates to — makes forward-reachability of leaf screens machine-checkable by bin/check-app; must be a registered screen. Omit for in-place EVENT actions and structural nav:<id> buttons"
          },
          "writes": {
            "type": "array",
            "description": "what this action mutates, in write-order: bound-collection entries execute per the executor rule (PROCESSES.md §EVENT — module-declared procedure first, direct conventional writes only on writable collections), {state} entries are app-local memory",
            "items": {
              "type": "object",
              "additionalProperties": false,
              "oneOf": [
                { "required": ["binding", "op"] },
                { "required": ["state"] }
              ],
              "properties": {
                "binding": { "type": "string", "description": "a bindings[].id this action writes" },
                "op": { "enum": ["create-record", "update-record", "move-record", "delete-record"] },
                "field": { "type": "string" },
                "state": { "type": "string", "description": "an app-local state/ file this action writes" }
              }
            }
          }
        }
      }
    },
    "bindings": {
      "type": "array",
      "description": "the binding registry (APP_MODEL.md §bindings) — one row per bound region; ids unique; cross-field law (region/screen existence, context.json resolution, read-write-has-writer) audited by bin/check-app",
      "items": {
        "type": "object",
        "required": ["id", "region", "screen", "source", "mode", "direction"],
        "additionalProperties": false,
        "properties": {
          "id": { "type": "string", "minLength": 1 },
          "region": { "type": "string", "minLength": 1, "description": "the region this binding feeds" },
          "screen": { "type": "string", "minLength": 1, "description": "the screen that region lives on" },
          "source": {
            "type": "object",
            "additionalProperties": false,
            "oneOf": [
              { "required": ["module", "collection"] },
              { "required": ["tenant"] },
              { "required": ["context"] }
            ],
            "properties": {
              "module": { "type": "string", "description": "dotted module name — must resolve in context.json#modules" },
              "collection": { "type": "string", "description": "collection id (optionally id/sub-path) declared by that module" },
              "select": { "const": "*", "description": "v1 grammar: '*' (whole collection) only" },
              "tenant": { "type": "string", "description": "tenant-relative file path (read-only sugar equivalent: data_sources[])" },
              "context": { "type": "string", "description": "derived-mode query over context.json" }
            }
          },
          "shape": { "enum": ["folder-of-records", "record", "file", "table", "derived"] },
          "mode": { "enum": ["bound", "derived", "provision"] },
          "direction": { "enum": ["read", "read-write"] },
          "reactive": { "enum": ["on-event", "live"], "description": "absent = on-event (today's mechanism); live requires the kernel file-event bridge (KERNEL_ASKS #11)" },
          "provisioned": { "type": "boolean", "description": "true when this binding's records were provisioned by this app (provision-then-bind)" }
        }
      }
    }
  }
}
