{
  "app": "rasa.app.v1",
  "id": "leaf-missing-back",
  "name": "Leaf missing back button (must FAIL)",
  "version": "0.1.0",
  "created": "2026-07-12",
  "screens": [
    { "id": "home", "title": "Home", "default": true },
    { "id": "d", "title": "Detail", "parent": "home" }
  ],
  "active_screen": "home",
  "events": [
    { "action": "nav:d", "emits": ["go"], "handling": "SWITCH_SCREEN d", "target": "d" }
  ]
}
