{
  "app": "rasa.app.v1",
  "id": "leaf-nav-to-sibling",
  "name": "Leaf nav to sibling (must FAIL)",
  "version": "0.1.0",
  "created": "2026-07-12",
  "screens": [
    { "id": "home", "title": "Home", "default": true },
    { "id": "a", "title": "A", "parent": "home" },
    { "id": "b", "title": "B", "parent": "home" }
  ],
  "active_screen": "home",
  "events": [
    { "action": "nav:a", "emits": ["go"], "handling": "SWITCH_SCREEN a", "target": "a" },
    { "action": "nav:b", "emits": ["go"], "handling": "SWITCH_SCREEN b", "target": "b" },
    { "action": "nav:home", "emits": ["nav"], "handling": "SWITCH_SCREEN home" }
  ]
}
